{
  "id": "NAVI2E-40",
  "module": "programs",
  "priority": "Medium",
  "type": "positive",
  "title": "Поделиться программой в соцсетях (или «Публикация ссылки на программу в соцсетях»)",
  "preconditions": [
    "На стенде существует опубликованная программа, доступная на публичном сайте по адресу /program/{id}-{slug} .",
    "Пользователь может быть как авторизован, так и не авторизован (функционал доступен всем).",
    "Открыть страницу программы (например, https://www.{СТЕНД}.navi.inlearno.info/program/1222-programma-3108-1 )."
  ],
  "steps": [
    {
      "step_number": 1,
      "action": "На странице программы найти и нажать кнопку \"Поделиться\" (иконка со стрелками, расположена в правом верхнем углу карточки программы, рядом с кнопкой \"В избранное\").",
      "expected_result": "Открывается модальное окно \"Поделиться\" с иконками социальных сетей: MAX (бывший Mail.ru ) ВКонтакте Одноклассники Иконка ссылки (копировать URL) Модальное окно можно закрыть кнопкой \"X\" в правом верхнем углу."
    },
    {
      "step_number": 2,
      "action": "Нажать на иконку ссылки (копировать URL) в модальном окне \"Поделиться\".",
      "expected_result": "Ссылка на текущую страницу программы скопирована в буфер обмена. Отображается уведомление \"Ссылка скопирована\". Вставить ссылку в новую вкладку браузера — открывается та же карточка программы (корректный адрес /program/{id}-{slug} )."
    },
    {
      "step_number": 3,
      "action": "Нажать на иконку \"ВКонтакте\" в модальном окне \"Поделиться\".",
      "expected_result": "Открывается новая вкладка браузера с адресом https://vk.ru/share.php?url=... Отображается форма публикации ВКонтакте: Поле \"Выберите аудиторию\" с вариантами: \"Друзья и подписчики\" (выбрано по умолчанию), \"Отправить личным сообщением\" Поле \"Ваш комментарий\" (пустое) Чекбокс \"добавить изображение\" (отмечен по умолчанию) Превью публикации: изображение программы, название \"Программа 31/08 - 1\", URL сайта Кнопка \"Отправить\" Ссылка на программу автоматически подставлена в форму."
    },
    {
      "step_number": 4,
      "action": "Вернуться на сайт и нажать на иконку \"MAX\" в модальном окне \"Поделиться\".",
      "expected_result": "Открывается новая вкладка браузера с адресом https://max.ru/:share?text=... Отображается страница MAX с модальным окном: Заголовок: \"Поделитесь публикацией с близкими\" Кнопка \"Поделиться в MAX\" (синяя) Ссылка \"Открыть в браузере\" Ссылка на программу автоматически подставлена в URL."
    },
    {
      "step_number": 5,
      "action": "Закрыть модальное окно \"Поделиться\" кнопкой \"X\".",
      "expected_result": "Модальное окно закрывается. Пользователь возвращается на страницу программы. Кнопка \"Поделиться\" доступна для повторного нажатия."
    }
  ],
  "expected_result": "Проверка функционала \"Поделиться\" на странице программы. Тестирование открытия модального окна, копирования ссылки и публикации в социальных сетях (ВКонтакте, MAX, Одноклассники).",
  "notes": "Проверка функционала \"Поделиться\" на странице программы. Тестирование открытия модального окна, копирования ссылки и публикации в социальных сетях (ВКонтакте, MAX, Одноклассники).\nLegacy: статус=Actual, серьезность=Major"
}
