{
  "id": "NAVI2E-39",
  "module": "programs",
  "priority": "High",
  "type": "positive",
  "title": "Подача заявки на программу с сайта",
  "preconditions": [
    "Авторизоваться на сайте https://www.{СТЕНД}.navi.inlearno.info под аккаунтом родителя.",
    "В профиле родителя добавлен минимум один ребёнок с корректной датой рождения, подтверждённый в админке (признак \"Подтверждён\" = Да).",
    "В реестре \"Программы\" существует опубликованная программа с активной группой: Статус: \"Опубликовано\" (зелёный бейдж) Включён приём заявок Есть свободные места Возрастные ограничения соответствуют возрасту ребёнка из п.2 Пример: Программа 31/08 - 1, Группа 123, возраст 1-18 лет Запомнить название программы и группы для проверки."
  ],
  "steps": [
    {
      "step_number": 1,
      "action": "Найти в каталоге программу из предусловий (через категорию или поиск) и открыть её карточку.",
      "expected_result": "Открывается страница программы с полной информацией: Название, артикул, группа Преподаватель, возраст, период освоения Расписание, адрес, форма обучения План приёма (всего мест, новые заявки, подтверждённые заявки, обучается) Отображается кнопка \"Записаться\" (активная, фиолетовая). Отображается ссылка \"Записаться через Госуслуги\"."
    },
    {
      "step_number": 2,
      "action": "Нажать кнопку \"Записаться\".",
      "expected_result": "Открывается модальное окно \"ОФОРМЛЕНИЕ ЗАЯВКИ\" с информацией: Название программы Выбранная группа (например, \"Группа 123 (Текущий учебный год)\") Детали программы: артикул, преподаватель, возраст, период, расписание, план приёма, адрес Стоимость (например, \"1 200 ₽ в месяц\") Кнопка \"Подать заявку\" (зелёная, активная) Ссылка \"Выбрать другую группу\" Блок \"Обучающийся\" со списком детей родителя и чекбоксами для выбора Кнопка \"Добавить обучающегося\""
    },
    {
      "step_number": 3,
      "action": "В блоке \"Обучающийся\" отметить чекбокс напротив ребёнка из предусловий (например, \"Овчинников Алексей, 12.02.2020, 6 лет\"). Нажать кнопку \"Подать заявку\".",
      "expected_result": "Отображается модальное окно \"ОФОРМЛЕНИЕ ЗАЯВКИ\" с названием программы (\"Программа 31/08 - 1\") и следующим содержимым: Заголовок: \"Заявка принята и будет обработана в ближайшее время.\" Предупреждение красным цветом: \"Внимание! Настоящая заявка не является фактом зачисления на обучение.\" Текст: \"На вашу электронную почту направлено уведомление с контактами организатора. Если с вами не связались в течение 7-ми рабочих дней, пожалуйста, позвоните по указанному телефону для уточнения статуса заявки.\" Кнопка \"Да, понятно\" (синяя). Блок \"Пригласите друзей на программу\" с иконками соцсетей (Одноклассники, ВКонтакте, OK и ссылка для копирования). На email родителя (из Stubmails) приходит уведомление с контактами организатора."
    },
    {
      "step_number": 4,
      "action": "Открыть раздел «Заявки» в админке и отфильтровать по программе.",
      "expected_result": "Новая заявка присутствует с корректными данными: программа, группа, ребёнок, заявитель, дата, статус «Новая»."
    },
    {
      "step_number": 5,
      "action": "Перейти в личный кабинет родителя (раздел \"ЗАЯВКИ\" → \"История заявок\")",
      "expected_result": "В разделе \"ЗАЯВКИ\" отображается новая заявка со следующими данными: Статус: \"Новая\" (выделен красным цветом) Название программы: \"Программа 31/08 - 1\" Дата оформления: текущая дата (например, \"07.09.2026\") Обучающийся: ФИО ребёнка из предусловий (например, \"Овчинников Алексей\") Учебный год: \"2023-2024\" Номер заявки: присвоен системой (например, \"2602\") Группа: \"Группа 123 (1359)\" Под карточкой заявки отображается информационное сообщение: \"Ожидайте, администратор учреждения свяжется с вами в ближайшее время\" (на красном фоне). Рядом с заявкой отображается текст: \"Действующих договоров нет\" . Доступны действия: Кнопка \"ОТМЕНИТЬ\" (красная) Ссылка \"ОТКРЫТЬ СТРАНИЦУ ПРОГРАММЫ\" В правой панели \"ОБУЧАЮЩИЕСЯ\" отображается профиль ребёнка, на которого подана заявка (например, \"Алексей Овчинников, 6 лет\")."
    }
  ],
  "expected_result": "Позитивное тестирование подачи заявки на программу через публичный сайт. Проверка полного цикла: от открытия карточки программы до подтверждения заявки и проверки в личном кабинете родителя.",
  "notes": "Позитивное тестирование подачи заявки на программу через публичный сайт. Проверка полного цикла: от открытия карточки программы до подтверждения заявки и проверки в личном кабинете родителя.\nLegacy: статус=Actual, серьезность=Critical"
}
