{
  "id": "NAVI2E-38",
  "module": "programs",
  "priority": "High",
  "type": "positive",
  "title": "Поиск программы в каталоге сайта",
  "preconditions": [
    "На сайте опубликовано несколько программ разных направленностей; известно название одной из них."
  ],
  "steps": [
    {
      "step_number": 1,
      "action": "Открыть каталог программ на публичном сайте.",
      "expected_result": "Отображается рубрикатор направленностей (Социально-гуманитарная, Техническая и др.) со счётчиками программ по профилям."
    },
    {
      "step_number": 2,
      "action": "Ввести в поиск каталога точное название опубликованной программы.",
      "expected_result": "Программа найдена и отображается в результатах."
    },
    {
      "step_number": 3,
      "action": "Ввести часть названия (одно слово) в другом регистре.",
      "expected_result": "Поиск нечувствителен к регистру, программа присутствует в результатах."
    },
    {
      "step_number": 4,
      "action": "Выбрать в рубрикаторе направленность и профиль программы.",
      "expected_result": "Программа отображается в списке своего профиля; количество программ соответствует счётчику рубрики."
    },
    {
      "step_number": 5,
      "action": "Ввести заведомо несуществующую строку.",
      "expected_result": "Отображается корректное пустое состояние («ничего не найдено»), без ошибок интерфейса. Отображается текст: \" К сожалению, нам не удалось найти ничего идеально подходящего. \""
    },
    {
      "step_number": 6,
      "action": "Проверить, что черновики и программы на модерации не попадают в результаты поиска.",
      "expected_result": "В выдаче только опубликованные программы."
    }
  ],
  "expected_result": "Программы можно искать через строек поиска. Найти можно программы в статусе \"опубликовано\" Поиск можно производить по: id программы / По названию программы (Поиск игнорирует регистр )",
  "notes": "Программы можно искать через строек поиска. Найти можно программы в статусе \"опубликовано\" Поиск можно производить по: id программы / По названию программы (Поиск игнорирует регистр )\nLegacy: статус=Actual, серьезность=Major"
}
