{
  "id": "NAVI2E-856",
  "module": "activities",
  "priority": "Medium",
  "type": "positive",
  "title": "Сайт. Мероприятия. Календарь: сохранение активных фильтров при навигации между месяцами",
  "preconditions": [
    "На стенде опубликованы мероприятия в нескольких месяцах.",
    "Открыть календарь мероприятий.",
    "Применить любой фильтр (например, по разделу) Запомнить применённый фильтр и текущий месяц."
  ],
  "steps": [
    {
      "step_number": 1,
      "action": "Используя кнопку-стрелку → (вперёд) или селектор месяца, перейти к следующему месяцу.",
      "expected_result": "Календарь перестроился на новый месяц. Панель фильтрации остаётся открытой. Выбранный фильтр (раздел) сохраняется в поле \"Раздел\". Кнопка \"ПРИМЕНИТЬ\" остаётся активной (или фильтр применяется автоматически — уточнить по факту). Счётчики мероприятий в новом месяце пересчитаны с учётом активного фильтра (показывают только мероприятия выбранного раздела). Хлебные кроки обновились на новый месяц."
    },
    {
      "step_number": 2,
      "action": "Вернуться к предыдущему месяцу (кнопка ← или селектор).",
      "expected_result": "Календарь вернулся к исходному месяцу. Фильтр всё ещё активен. Счётчики соответствуют отфильтрованной выдаче исходного месяца."
    }
  ],
  "expected_result": "Проверка что применённые фильтры сохраняются при переключении месяцев в календаре, и счётчики нового месяца учитывают активные фильтры.",
  "notes": "Проверка что применённые фильтры сохраняются при переключении месяцев в календаре, и счётчики нового месяца учитывают активные фильтры.\nLegacy: статус=Actual, серьезность=Major"
}
