{
  "id": "NAVI2E-853",
  "module": "activities",
  "priority": "Medium",
  "type": "positive",
  "title": "Сайт. Мероприятия. Календарь: переход к списку мероприятий на выбранную дату",
  "preconditions": [
    "На стенде опубликованы мероприятия на конкретную дату На календаре у этой даты отображается счётчик мероприятий Открыть календарь мероприятий Открыть страницу МЕРОПРИЯТИЯ https://www.{СТЕНД}.navi.inlearno.info /activities-calendar"
  ],
  "steps": [
    {
      "step_number": 1,
      "action": "В календаре кликнуть на любой день со счётчиком мероприятий (день, у которого под числом отображается иконка с числом).",
      "expected_result": "Открывается страница списка мероприятий на выбранную дату (URL: /activities?date={ГОД}-{ММ}-{ДД} ). Хлебные кроки обновлены: \"ГЛАВНАЯ | КАЛЕНДАРЬ МЕРОПРИЯТИЙ | {ГОД} | {МЕСЯЦ} | {ЧИСЛО}\" Слева отображается блок с датой: День недели (например, \"ПОНЕДЕЛЬНИК\") Число (выбранное число) Месяц (например, \"СЕНТЯБРЯ\") Текст \"ПРОВОДИТСЯ {N} МЕРОПРИЯТИЙ\" (где N — число со счётчика, зелёным цветом для будущих дат) Кнопка \"ВЕРНУТЬСЯ В КАЛЕНДАРЬ МЕРОПРИЯТИЙ\" Стрелки ← → для навигации между днями Справа отображается сетка карточек мероприятий (4 в ряд). Каждая карточка содержит: Изображение мероприятия Название Подзаголовок/категория Кнопка \"ПОДРОБНЕЕ\" (синяя) Количество карточек соответствует счётчику на календаре (N мероприятий)."
    },
    {
      "step_number": 2,
      "action": "На любой карточке мероприятия нажать кнопку \"ПОДРОБНЕЕ\".",
      "expected_result": "Открывается детальная страница мероприятия (URL: /activity/{id}/?date={ГОД}-{ММ}-{ДД} ). Отображается полная информация о мероприятии: Название мероприятия Дата проведения (соответствует выбранной дате) Время (выпадающий список с вариантами времени) Кнопка \"ЗАПИСАТЬСЯ\" (зелёная) Адрес проведения Уровень, форма обучения, участники Контакты организатора Большое изображение Вкладки \"ОПИСАНИЕ\" и \"ДОКУМЕНТЫ\" Блок \"ДЛИТЕЛЬНОСТЬ\""
    },
    {
      "step_number": 3,
      "action": "Вернуться на страницу списка мероприятий (через кнопку \"Назад\" в браузере или через хлебные кроки). Нажать кнопку \"ВЕРНУТЬСЯ В КАЛЕНДАРЬ МЕРОПРИЯТИЙ\" в левом блоке.",
      "expected_result": "Происходит возврат на страницу календаря мероприятий. Отображается календарь того же месяца, что был до перехода. Хлебные кроки: \"ГЛАВНАЯ | КАЛЕНДАРЬ МЕРОПРИЯТИЙ | {ГОД} | {МЕСЯЦ}\""
    }
  ],
  "expected_result": "Проверка перехода от календаря к списку мероприятий на конкретный день и возврата обратно.",
  "notes": "Проверка перехода от календаря к списку мероприятий на конкретный день и возврата обратно.\nLegacy: статус=Draft, серьезность=Major"
}
