{
  "id": "NAVI2E-7",
  "module": "authorization",
  "priority": "Medium",
  "type": "positive",
  "title": "Восстановление пароля: отправка ссылки для сброса на email(сайт)",
  "preconditions": [
    "Иметь подтвержденный аккаунт пользователя (если нет — выполнить тест-кейс \" Регистрация: успешное создание аккаунта с валидными данными \" ).",
    "Запомнить email созданного пользователя.",
    "Выйти из аккаунта на сайте, если авторизован.",
    "Находиться на главной странице сайта https://www.{СТЕНД}.navi.inlearno.info"
  ],
  "steps": [
    {
      "step_number": 1,
      "action": "Нажать кнопку \"ВХОД\" в правом верхнем углу, затем перейти на вкладку \"НЕ ПОМНЮ ПАРОЛЬ\".",
      "expected_result": "Открывается модальное окно. Активна вкладка \"НЕ ПОМНЮ ПАРОЛЬ\" . Отображается форма с полями:"
    },
    {
      "step_number": 2,
      "action": "Ввести в поле email адрес из предусловия. Нажать кнопку \"ВОССТАНОВИТЬ МОЙ ПАРОЛЬ\"",
      "expected_result": "На форме отображается уведомление: \"\" Новый пароль будет отправлен на ваш электронный адрес \" ВАШ ЭЛЕКТРОННЫЙ АДРЕС\" \""
    },
    {
      "step_number": 3,
      "action": "Перейти на внутренний почтовый сервис Stubmails , найти письмо и открыть его.",
      "expected_result": "Письмо получено в течение 2 минут. В теле письма содержится пароль."
    },
    {
      "step_number": 4,
      "action": "Вернуться на сайт https://www.{СТЕНД}.navi.inlearno.info , нажать кнопку \"ВХОД\", ввести учетные данные и авторизоваться: В поле \"Ваш EMAIL\": EMAIL по которому сбрасывали пароль В поле \"Ваш ПАРОЛЬ\": пароль, полученный из письма (Шаг 3) Нажать кнопку \"ВОЙТИ\"",
      "expected_result": "Модальное окно закрывается. Происходит перенаправление на главную страницу сайта. В правом верхнем углу вместо кнопок \"РЕГИСТРАЦИЯ\" и \"ВХОД\" отображается ФИО пользователя. Пользователь успешно авторизован в системе с новым паролем."
    }
  ],
  "expected_result": "Проверка сброса пароля: функция работает корректно. Аутентификация с новым паролем выполнена успешно",
  "notes": "Позитивное тестирование функции восстановления пароля на публичном сайте навигатора дополнительного образования. Проверка полного цикла: запрос сброса → получение письма → переход по ссылке.\nLegacy: статус=Actual, серьезность=Major"
}
