{
  "id": "NAVI2E-426",
  "module": "news",
  "priority": "Medium",
  "type": "positive",
  "title": "Просмотр предыдущей, следующей записей, всех записей",
  "preconditions": [
    "На сайте опубликовано несколько записей блога с разными датами."
  ],
  "steps": [
    {
      "step_number": 1,
      "action": "Открыть любую запись блога на сайте.",
      "expected_result": "На странице записи есть ссылки на предыдущую/следующую записи и ссылка на все записи."
    },
    {
      "step_number": 2,
      "action": "Нажать ссылку «Следующая запись».",
      "expected_result": "Открыта соседняя по дате публикации запись."
    },
    {
      "step_number": 3,
      "action": "Нажать ссылку «Предыдущая запись».",
      "expected_result": "Выполнен возврат к исходной записи."
    },
    {
      "step_number": 4,
      "action": "Нажать ссылку «Все записи».",
      "expected_result": "Открыт список всех опубликованных записей блога."
    },
    {
      "step_number": 5,
      "action": "Открыть самую свежую и самую старую записи.",
      "expected_result": "Отсутствующая ссылка (следующая у свежей / предыдущая у старой) скрыта или неактивна, ошибок нет."
    }
  ],
  "expected_result": "Отсутствующая ссылка (следующая у свежей / предыдущая у старой) скрыта или неактивна, ошибок нет.",
  "notes": "Legacy: статус=Draft, серьезность=Major"
}
