{
  "id": "NAVI2E-37",
  "module": "programs",
  "priority": "High",
  "type": "positive",
  "title": "Отображение опубликованной программы на сайте",
  "preconditions": [
    "Есть опубликованная программа с заполненными обложкой, описанием, возрастом, адресом и группой с источником финансирования «Сертификат»."
  ],
  "steps": [
    {
      "step_number": 1,
      "action": "Открыть карточку программы на сайте по адресу /program/{id}-{slug}.",
      "expected_result": "Страница открывается со статусом 200; заголовок равен публичному наименованию программы."
    },
    {
      "step_number": 2,
      "action": "Проверить блок параметров карточки.",
      "expected_result": "Возраст «от X до Y лет», План приема, Форма обучения, Оплата сертификатом, ОВЗ, Адрес и Муниципалитет соответствуют данным карточки в админке."
    },
    {
      "step_number": 3,
      "action": "Проверить бейдж «Доступна оплата сертификатом» и кнопку «Записаться».",
      "expected_result": "Бейдж отображается (есть группа с финансированием «Сертификат»); кнопка «Записаться» активна."
    },
    {
      "step_number": 4,
      "action": "Проверить блок контактов организации.",
      "expected_result": "Телефон, e-mail и сайт совпадают с вкладкой «Контакты» карточки организации; ссылка «Все программы организатора» ведёт на страницу организации."
    },
    {
      "step_number": 5,
      "action": "Проверить хлебные крошки и рубрику.",
      "expected_result": "Программа отнесена к своей направленности и профилю (например, Социально-гуманитарная / Волонтёрская работа) в соответствии с вкладкой «Раздел»."
    },
    {
      "step_number": 6,
      "action": "Переключить вкладки Описание / Группы / Педагоги / Отзывы / Анкета.",
      "expected_result": "Каждая вкладка открывается и показывает данные, соответствующие админке."
    }
  ],
  "expected_result": "Каждая вкладка открывается и показывает данные, соответствующие админке.",
  "notes": "Legacy: статус=Draft, серьезность=Critical"
}
