{
  "id": "NAVI2E-43",
  "module": "programs",
  "priority": "Medium",
  "type": "positive",
  "title": "Сайт. Программа. Отображение расписания группы на публичном сайте",
  "preconditions": [
    "На стенде существует опубликованная программа с активной группой, у которой заполнено расписание: Дни недели (например, ПН, ВТ, СР, ЧТ, ПТ) Время занятий (например, 17:20 - 18:05) Период обучения (например, 01.01.2026 - 13.12.2026) Программа доступна на публичном сайте по адресу /program/{id}-{slug} ."
  ],
  "steps": [
    {
      "step_number": 1,
      "action": "Открыть карточку программы на сайте https://www.{СТЕНД}.navi.inlearno.info/program/{id}-{slug} .",
      "expected_result": "Отображается страница программы с блоком параметров: Расписание: дни недели и время (например, \"ПН, ВТ, СР, ЧТ, ПТ, СБ, ВС: 17:20 - 18:05\") Период освоения программы: даты начала и окончания (например, \"01.01.2026 - 13.12.2026\") Если есть вкладка/раздел \"Группы\" — отображается список групп с расписанием."
    },
    {
      "step_number": 2,
      "action": "Сверить расписание на сайте с данными в админке (вкладка \"Расписание\" диалога группы).",
      "expected_result": "Все данные полностью совпадают: Дни недели Время занятий Период обучения (даты начала и окончания)"
    }
  ],
  "expected_result": "Проверка корректности отображения расписания группы на публичном сайте. Сверка данных с админкой.",
  "notes": "Проверка корректности отображения расписания группы на публичном сайте. Сверка данных с админкой.\nLegacy: статус=Actual, серьезность=Major"
}
