{
  "id": "NAVI2E-193",
  "module": "activities",
  "priority": "High",
  "type": "positive",
  "title": "Календарь мероприятий: отображение и навигация по месяцам",
  "preconditions": [
    "На стенде опубликованы мероприятия в текущем и следующем месяце (минимум по 1-2 мероприятия в разных месяцах).",
    "Авторизация не требуется.",
    "Открыть главную страницу сайта https://www.{СТЕНД}.navi.inlearno.info ."
  ],
  "steps": [
    {
      "step_number": 1,
      "action": "В шапке сайта нажать пункт меню \"МЕРОПРИЯТИЯ\".",
      "expected_result": "Открывается страница календаря мероприятий (URL: /activities-calendar ). Отображается сетка календаря на текущий месяц (ПН-ВС). Вверху отображаются: Выпадающий список года (например, \"2026\") Выпадающий список месяца (например, \"Сентябрь\") Синие кнопки-стрелки ← → для навигации Хлебные кроки: \"ГЛАВНАЯ | КАЛЕНДАРЬ МЕРОПРИЯТИЙ | 2026 | СЕНТЯБРЬ\" У дней с мероприятиями под числом отображается иконка \"книжки\" с количеством мероприятий."
    },
    {
      "step_number": 2,
      "action": "Нажать кнопку-стрелку → (вперёд) для перехода к следующему месяцу.",
      "expected_result": "Календарь перестроился на следующий месяц (например, Октябрь 2026). Хлебные кроки обновились: \"ГЛАВНАЯ | КАЛЕНДАРЬ МЕРОПРИЯТИЙ | 2026 | ОКТЯБРЬ\" Селектор месяца вверху изменился на \"Октябрь\". Отображаются дни следующего месяца с соответствующими счётчиками мероприятий."
    },
    {
      "step_number": 3,
      "action": "Нажать кнопку-стрелку ← (назад) для возврата к предыдущему месяцу.",
      "expected_result": "Календарь вернулся к предыдущему месяцу (например, Сентябрь 2026). Хлебные кроки обновились: \"ГЛАВНАЯ | КАЛЕНДАРЬ МЕРОПРИЯТИЙ | 2026 | СЕНТЯБРЬ\" Отображаются дни предыдущего месяца."
    },
    {
      "step_number": 4,
      "action": "Использовать выпадающий список месяца для выбора другого месяца (например, \"Август\").",
      "expected_result": "Календарь перестроился на выбранный месяц (Август 2026). Хлебные кроки обновились: \"ГЛАВНАЯ | КАЛЕНДАРЬ МЕРОПРИЯТИЙ | 2026 | АВГУСТ\" Отображаются дни выбранного месяца."
    }
  ],
  "expected_result": "Проверка корректности отображения календаря мероприятий и работы навигации между месяцами через стрелки и селекторы.",
  "notes": "Проверка корректности отображения календаря мероприятий и работы навигации между месяцами через стрелки и селекторы.\nLegacy: статус=Actual, серьезность=Major"
}
