{
  "id": "NAVI2E-2",
  "module": "cabinet",
  "priority": "High",
  "type": "positive",
  "title": "Добавление ребёнка: успешное создание с валидными данными",
  "preconditions": [
    "Перед началом тестирования у тебя должен быть создан аккаунт на сайте Перед началом тестирования ты должен быть авторизован на сайте Перед началом тестирования ты должен находиться в кабинете пользователя сайта"
  ],
  "steps": [
    {
      "step_number": 1,
      "action": "Нажать кнопку \" Добавить профиль обучающегося \"",
      "expected_result": "Открылась форма для заполнения данных о ребенке \"Обучающиеся\": (input) \"ФАМИЛИЯ\" (input) \"ИМЯ\" (input) \"ОТЧЕСТВО\" (input) \"ДЕНЬ РОЖДЕНИЯ\" (input) \"ПОЛ\" (input) \"СНИЛС\" (check-box) \"Один из родителей (законных представителей) обучающегося является участником СВО\" (button) \"Добавить профиль обучающегося\" (button) \"Назад\""
    },
    {
      "step_number": 2,
      "action": "Заполнить обязательные поля используя генератор тестовых данных из предусловия Нажать кнопку \" Добавить профиль обучающегося \"",
      "expected_result": "В профиле появились данные о ребенке Ребенок в статусе неподтвержден. У иконки нового ребенка есть значок \"Восклицательный знак\" При наведении на восклицательный знак всплывает подсказка \" Данные о ребенке необходимо подтвердить в любом учреждении доп. образования. При себе иметь СНИЛС ребенка и ваш паспорт. \""
    }
  ],
  "expected_result": "Обязательность полей при добавлении ребёнка. Значения из выпадающих списков. В полях: мин. , макс., минусовые значения, соответствие заданным Маскам, соответствие типов. Подсказки к полям. Наличие проверок полей на ввод небезопасных данных (кусков кода и т.д.) Вложений в исходной выгрузке FireTMS: 5 (не перенесены)",
  "notes": "Обязательность полей при добавлении ребёнка. Значения из выпадающих списков. В полях: мин. , макс., минусовые значения, соответствие заданным Маскам, соответствие типов. Подсказки к полям. Наличие проверок полей на ввод небезопасных данных (кусков кода и т.д.) Вложений в исходной выгрузке FireTMS: 5 (не перенесены)\nLegacy: статус=Draft, серьезность=Major"
}
