{
  "id": "NAVI2E-427",
  "module": "news",
  "priority": "Medium",
  "type": "positive",
  "title": "Поделиться в соц. сетях",
  "preconditions": [
    "На сайте открыта опубликованная запись блога; на странице есть кнопки «Поделиться»."
  ],
  "steps": [
    {
      "step_number": 1,
      "action": "Проверить наличие кнопок «Поделиться» в соцсетях на странице записи.",
      "expected_result": "Кнопки шаринга отображаются."
    },
    {
      "step_number": 2,
      "action": "Нажать кнопку одной из соцсетей.",
      "expected_result": "Открыто окно шаринга соответствующей соцсети; в передаваемых параметрах — корректный URL записи и заголовок."
    },
    {
      "step_number": 3,
      "action": "Поочерёдно проверить остальные кнопки.",
      "expected_result": "Каждая кнопка формирует ссылку своей соцсети с корректным адресом записи."
    },
    {
      "step_number": 4,
      "action": "Открыть URL записи из окна шаринга в новой вкладке.",
      "expected_result": "Запись открывается по этой ссылке корректно."
    }
  ],
  "expected_result": "Запись открывается по этой ссылке корректно.",
  "notes": "Legacy: статус=Draft, серьезность=Major"
}
