{
  "id": "NAVI2E-200",
  "module": "activities",
  "priority": "High",
  "type": "positive",
  "title": "Подача заявки на мероприятие с сайта",
  "preconditions": [
    "Пользователь сайта зарегистрирован, авторизован, в профиле добавлен ребёнок.",
    "На сайте есть опубликованное мероприятие с открытой записью на будущую дату."
  ],
  "steps": [
    {
      "step_number": 1,
      "action": "Открыть карточку мероприятия.",
      "expected_result": "Кнопка «Записаться» активна; доступен выбор даты и времени из допустимых значений."
    },
    {
      "step_number": 2,
      "action": "Выбрать дату и время, нажать «Записаться».",
      "expected_result": "Открылась форма записи с выбором ребёнка/участника."
    },
    {
      "step_number": 3,
      "action": "Выбрать ребёнка и подтвердить запись.",
      "expected_result": "Показано сообщение об успешной подаче заявки; заявка появилась в ЛК (история заявок) со статусом «Новая»."
    },
    {
      "step_number": 4,
      "action": "Проверить реестр «Заявки на мероприятия» в админке.",
      "expected_result": "Заявка присутствует со статусом «Новая», данные (мероприятие, дата, время, ребёнок, представитель) совпадают."
    }
  ],
  "expected_result": "Заявка присутствует со статусом «Новая», данные (мероприятие, дата, время, ребёнок, представитель) совпадают.",
  "notes": "Legacy: статус=Draft, серьезность=Critical"
}
