{
  "id": "NAVI2E-746",
  "module": "cabinet",
  "priority": "Medium",
  "type": "negative",
  "title": "Валидация СНИЛС и даты рождения ребёнка (негатив)",
  "preconditions": [
    "Открыта форма создания/редактирования ребёнка."
  ],
  "steps": [
    {
      "step_number": 1,
      "action": "Ввести СНИЛС с неверной контрольной суммой (например, 111-111-111 11).",
      "expected_result": "Валидация отклоняет значение с сообщением об ошибке."
    },
    {
      "step_number": 2,
      "action": "Ввести СНИЛС буквами/меньше 11 цифр.",
      "expected_result": "Маска не позволяет ввод или выдаётся ошибка формата."
    },
    {
      "step_number": 3,
      "action": "Ввести дату рождения в будущем.",
      "expected_result": "Сохранение блокируется с сообщением об ошибке."
    },
    {
      "step_number": 4,
      "action": "Ввести дату рождения, дающую возраст вне допустимого диапазона платформы (например, 30 лет).",
      "expected_result": "Система предупреждает или блокирует согласно правилам платформы (5-18 лет для сертификатов)."
    }
  ],
  "expected_result": "Система предупреждает или блокирует согласно правилам платформы (5-18 лет для сертификатов).",
  "notes": "Legacy: статус=Draft, серьезность=Major"
}
