{
  "id": "NAVI2E-441",
  "module": "news",
  "priority": "Medium",
  "type": "positive",
  "title": "Просмотреть отзывы",
  "preconditions": [
    "В админке у программы есть отзыв в статусе «Опубликовано» и отзыв в статусе «Черновик»."
  ],
  "steps": [
    {
      "step_number": 1,
      "action": "Открыть карточку программы на публичном сайте и перейти к блоку отзывов.",
      "expected_result": "Опубликованный отзыв отображается: ФИО, дата, рейтинг звёздами, текст отзыва."
    },
    {
      "step_number": 2,
      "action": "Сверить рейтинг и текст отзыва с данными в админке.",
      "expected_result": "Данные на сайте совпадают с карточкой отзыва в админке."
    },
    {
      "step_number": 3,
      "action": "Проверить средний рейтинг программы.",
      "expected_result": "Средний рейтинг соответствует среднему значению опубликованных отзывов."
    },
    {
      "step_number": 4,
      "action": "Убедиться, что отзыв в статусе «Черновик» на странице отсутствует.",
      "expected_result": "Черновики на сайте не отображаются и в средний рейтинг не входят."
    }
  ],
  "expected_result": "Черновики на сайте не отображаются и в средний рейтинг не входят.",
  "notes": "Legacy: статус=Draft, серьезность=Major"
}
