{
  "id": "NAVI2E-424",
  "module": "news",
  "priority": "Medium",
  "type": "positive",
  "title": "Блог на сайте. Оставить комментарий",
  "preconditions": [
    "На сайте есть опубликованная запись блога с включённым флагом «Можно комментировать» и выключенной модерацией.",
    "Есть учётка пользователя сайта."
  ],
  "steps": [
    {
      "step_number": 1,
      "action": "Открыть запись блога на сайте без авторизации",
      "expected_result": "Текст записи доступен; форма комментария недоступна либо предлагает авторизоваться"
    },
    {
      "step_number": 2,
      "action": "Авторизоваться пользователем сайта и открыть запись",
      "expected_result": "Форма добавления комментария доступна"
    },
    {
      "step_number": 3,
      "action": "Отправить пустой комментарий",
      "expected_result": "Отправка блокируется с сообщением об обязательности текста"
    },
    {
      "step_number": 4,
      "action": "Ввести текст и отправить комментарий",
      "expected_result": "Комментарий появляется под записью с именем автора и датой"
    },
    {
      "step_number": 5,
      "action": "В админке открыть карточку записи → вкладка «Комментарии»",
      "expected_result": "Отправленный комментарий отображается в списке"
    }
  ],
  "expected_result": "Отправленный комментарий отображается в списке",
  "notes": "Legacy: статус=Draft, серьезность=Major"
}
