{
  "id": "NAVI2E-197",
  "module": "activities",
  "priority": "Medium",
  "type": "positive",
  "title": "Просмотр мероприятий по разделам и подразделам",
  "preconditions": [
    "На сайте опубликованы мероприятия, привязанные к разным разделам и подразделам."
  ],
  "steps": [
    {
      "step_number": 1,
      "action": "Открыть пункт «Мероприятия» в шапке сайта и нажать кнопку «Фильтр».",
      "expected_result": "Открыт календарь мероприятий и панель фильтров с полями «Раздел» и «Подраздел»."
    },
    {
      "step_number": 2,
      "action": "Выбрать раздел и нажать «Применить».",
      "expected_result": "В календаре остались только мероприятия выбранного раздела; счётчики мероприятий по дням пересчитаны."
    },
    {
      "step_number": 3,
      "action": "Выбрать подраздел выбранного раздела и применить.",
      "expected_result": "Список подразделов соответствует выбранному разделу; выборка сужена до мероприятий подраздела."
    },
    {
      "step_number": 4,
      "action": "Открыть карточку одного из отфильтрованных мероприятий и сверить с админкой (вкладка «Раздел» карточки мероприятия).",
      "expected_result": "Раздел/подраздел мероприятия совпадает с выбранным в фильтре."
    },
    {
      "step_number": 5,
      "action": "Нажать «Сбросить всё».",
      "expected_result": "Фильтры очищены, отображаются все опубликованные мероприятия."
    }
  ],
  "expected_result": "Фильтры очищены, отображаются все опубликованные мероприятия.",
  "notes": "Legacy: статус=Draft, серьезность=Major"
}
