{
  "id": "NAVI2E-442",
  "module": "news",
  "priority": "High",
  "type": "positive",
  "title": "Отзывы на сайте. Оставить отзыв",
  "preconditions": [
    "Есть учётка пользователя сайта с ребёнком, зачисленным на программу (если по требованиям отзыв доступен только участникам).",
    "Открыта карточка программы на сайте."
  ],
  "steps": [
    {
      "step_number": 1,
      "action": "Открыть карточку программы без авторизации и перейти к блоку отзывов",
      "expected_result": "Отзывы читаются; кнопка «Оставить отзыв» требует авторизации"
    },
    {
      "step_number": 2,
      "action": "Авторизоваться пользователем сайта и нажать «Оставить отзыв»",
      "expected_result": "Открывается форма: рейтинг (звёзды) и текст отзыва"
    },
    {
      "step_number": 3,
      "action": "Отправить форму без рейтинга/текста",
      "expected_result": "Отправка блокируется с сообщением об обязательных полях"
    },
    {
      "step_number": 4,
      "action": "Выставить рейтинг, ввести текст, отправить",
      "expected_result": "Сообщение об успешной отправке; отзыв уходит на модерацию и сразу на сайте не публикуется"
    },
    {
      "step_number": 5,
      "action": "В админке открыть плитку «Отзывы»",
      "expected_result": "Новый отзыв появился в гриде со статусом «Черновик», заполнены программа, ФИО, email автора, дата"
    },
    {
      "step_number": 6,
      "action": "Опубликовать отзыв в админке и обновить карточку программы на сайте",
      "expected_result": "Отзыв отображается публично"
    }
  ],
  "expected_result": "Отзыв отображается публично",
  "notes": "Legacy: статус=Draft, серьезность=Major"
}
