{
  "id": "NAVI2E-195",
  "module": "activities",
  "priority": "Medium",
  "type": "positive",
  "title": "Сайт. Мероприятия. Просмотр списка всех мероприятий организатора",
  "preconditions": [
    "В системе существует организация-организатор.",
    "У организации есть мероприятия в трёх статусах: Минимум одно мероприятие в статусе «Опубликовано» Минимум одно мероприятие в статусе «Черновик» Минимум одно мероприятие в статусе «Архив» Минимум одно опубликованное мероприятие этой организации доступно на публичном сайте."
  ],
  "steps": [
    {
      "step_number": 1,
      "action": "Открыть карточку любого опубликованного мероприятия на публичном сайте (через календарь или поиск).",
      "expected_result": "Открывается детальная страница мероприятия (URL: /activity/{id}/ ). Отображается заголовок мероприятия (например, \"44.03.02 Психолого-педагогическое образование\"). В левой колонке отображаются блоки: Дата проведения (с иконкой календаря) Время (выпадающий список) Кнопка «ЗАПИСАТЬСЯ» (зелёная) Адрес проведения Уровень (например, \"Международное\") Форма обучения (например, \"Очная\") Участники (например, \"Учащиеся\") Все мероприятия организатора: ссылка с названием организации (например, \"Московский государственный университет имени М.В. Ломоносова\") Контакты организации: телефон и email В правой колонке отображается большое изображение мероприятия. Ниже расположены вкладки «ОПИСАНИЕ» и «ДОКУМЕНТЫ» . Внизу страницы отображается блок «ДЛИТЕЛЬНОСТЬ» (например, \"12 месяцев\")."
    },
    {
      "step_number": 2,
      "action": "В левой колонке нажать ссылку «Все мероприятия организатора: {название организации}» .",
      "expected_result": "Открывается страница со списком мероприятий данного организатора. URL страницы содержит фильтр по организатору (например, /activities?organizer={id} ). Отображается заголовок страницы с названием организации. Отображается сетка карточек мероприятий (4 в ряд). Каждая карточка содержит: Изображение мероприятия Название мероприятия Подзаголовок/категорию Кнопку «ПОДРОБНЕЕ» (синяя)"
    },
    {
      "step_number": 3,
      "action": "Проверить состав списка мероприятий на странице.",
      "expected_result": "В списке отображаются только мероприятия в статусе «Опубликовано». Мероприятия в статусах «Черновик» и «Архив» отсутствуют в списке. Все карточки мероприятий принадлежат одному организатору (название организации совпадает с исходным мероприятием из Шага 1). Количество карточек соответствует количеству опубликованных мероприятий организации (черновики и архивы не учитываются)."
    },
    {
      "step_number": 4,
      "action": "На любой карточке мероприятия из списка нажать кнопку «ПОДРОБНЕЕ».",
      "expected_result": "Открывается детальная страница выбранного мероприятия. В левой колонке в блоке «Все мероприятия организатора:» отображается та же организация, что и в исходном мероприятии (из Шага 1). Ссылка «Все мероприятия организатора» присутствует и кликабельна."
    }
  ],
  "expected_result": "На сайте отображаются только мероприятия в статусе \"Опубликовано\"",
  "notes": "Проверка функционала перехода к списку всех мероприятий организатора со страницы мероприятия. Проверка что в публичном списке отображаются только мероприятия в статусе «Опубликовано». Мероприятия в статусах «Черновик» и «Архив» не должны попадать в выдачу.\nLegacy: статус=Actual, серьезность=Major"
}
