{
  "id": "NAVI2E-6",
  "module": "authorization",
  "priority": "Medium",
  "type": "positive",
  "title": "Авторизация: успешный вход с корректными логином и паролем(сайт)",
  "preconditions": [
    "Иметь подтвержденный аккаунт пользователя (если нет — выполнить тест-кейс \" Регистрация: успешное создание аккаунта с валидными данными \").",
    "Запомнить логин и пароль созданного пользователя: Выйти из аккаунта на сайте, если авторизован.",
    "Находиться на главной странице сайта https://www.{СТЕНД}.navi.inlearno.info"
  ],
  "steps": [
    {
      "step_number": 1,
      "action": "Нажать кнопку \"ВХОД\" в правом верхнем углу.",
      "expected_result": "Открывается модальное окно с вкладками \"РЕГИСТРАЦИЯ\", \"ВХОД\", \"НЕ ПОМНЮ ПАРОЛЬ\". Активна вкладка \"ВХОД\" . Отображается форма с полями:"
    },
    {
      "step_number": 2,
      "action": "В поле \"Ваш EMAIL\": ввести EMAIL который ты подготовил по предусловию В поле \"Ваш ПАРОЛЬ\": ввести ПАРОЛЬ который ты подготовил по предусловию Нажать кнопку \"ВОЙТИ\"",
      "expected_result": "Модальное окно закрывается. Происходит перенаправление на главную страницу сайта. В правом верхнем углу вместо кнопок \"РЕГИСТРАЦИЯ\" и \"ВХОД\" отображается ФИО пользователя Пользователь успешно авторизован в системе."
    }
  ],
  "expected_result": "Успешная аутентификация с валидными учетными данными",
  "notes": "Позитивное тестирование авторизации на публичном сайте навигатора дополнительного образования. Проверка входа ранее зарегистрированного и подтвержденного пользователя.\nLegacy: статус=Actual, серьезность=Major"
}
