{
  "id": "NAVI2E-714",
  "module": "programs",
  "priority": "Medium",
  "type": "positive",
  "title": "Просмотр всех программ педагога",
  "preconditions": [
    "На сайте www.pfdod.navi.inlearno.info опубликована программа, в группах которой указаны педагоги с заполненными фото и достижениями (данные внесены через «Инвентаризацию»/профиль педагога).",
    "Педагог указан в группах нескольких опубликованных программ; есть и неопубликованная программа с этим педагогом."
  ],
  "steps": [
    {
      "step_number": 1,
      "action": "Открыть страницу педагога на сайте (переход из карточки любой его программы).",
      "expected_result": "Страница педагога открывается без ошибок."
    },
    {
      "step_number": 2,
      "action": "Проверить список программ педагога.",
      "expected_result": "Отображаются все опубликованные программы, в группах которых указан педагог."
    },
    {
      "step_number": 3,
      "action": "Перейти по ссылке в карточку одной из программ списка.",
      "expected_result": "Открывается корректная карточка программы."
    },
    {
      "step_number": 4,
      "action": "Убедиться, что неопубликованные/архивные программы отсутствуют в списке.",
      "expected_result": "Неопубликованные программы на странице педагога не отображаются."
    }
  ],
  "expected_result": "Неопубликованные программы на странице педагога не отображаются.",
  "notes": "Legacy: статус=Draft, серьезность=Major"
}
