{
  "id": "NAVI2E-423",
  "module": "news",
  "priority": "Medium",
  "type": "positive",
  "title": "Прочитать запись",
  "preconditions": [
    "В админке есть запись блога в статусе «Опубликовано» с форматированным текстом и запись в статусе «Черновик»."
  ],
  "steps": [
    {
      "step_number": 1,
      "action": "Открыть на сайте раздел новостей/блога.",
      "expected_result": "Отображается список записей с заголовками, датами и анонсами."
    },
    {
      "step_number": 2,
      "action": "Открыть опубликованную запись.",
      "expected_result": "Отображается полный текст статьи: заголовок, дата, содержимое поля «Статья»."
    },
    {
      "step_number": 3,
      "action": "Проверить форматирование текста (списки, жирный/курсив, ссылки, изображения из редактора).",
      "expected_result": "Форматирование, заданное в TinyMCE, отображается на сайте корректно, изображения загружаются."
    },
    {
      "step_number": 4,
      "action": "Найти на сайте запись в статусе «Черновик» (по прямой ссылке/поиску).",
      "expected_result": "Черновик на сайте не отображается и по прямой ссылке недоступен."
    }
  ],
  "expected_result": "Черновик на сайте не отображается и по прямой ссылке недоступен.",
  "notes": "Legacy: статус=Draft, серьезность=Major"
}
