{
  "id": "NAVI2E-45",
  "module": "programs",
  "priority": "Medium",
  "type": "positive",
  "title": "Программа. Заполнение анкеты оценки качества программы",
  "preconditions": [
    "На стенде существует опубликованная программа, доступная на публичном сайте по адресу /program/{id}-{slug} .",
    "Для программы настроена анкета (в админке создана и опубликована анкета с вопросами).",
    "Пользователь авторизован на сайте (если анкета требует авторизации)."
  ],
  "steps": [
    {
      "step_number": 1,
      "action": "Открыть карточку программы на сайте https://www.{СТЕНД}.navi.inlearno.info/program/{id}-{slug} . Перейти на вкладку \"Анкеты\".",
      "expected_result": "Отображается вкладка \"Анкеты\" (рядом с вкладкой \"Отзывы\"). Отображается текст-обращение к пользователю (например, \"Для улучшения качества обучения и достижения лучших результатов просим вас оценить текущую реализацию программы\"). Отображается форма анкеты с вопросами: Текст вопроса Шкала оценок от 1 до 10 (кнопки для выбора) Обязательные вопросы отмечены индикатором (звёздочка/подсветка) Внизу формы отображается кнопка \"Отправить анкету\" (зелёная)."
    },
    {
      "step_number": 2,
      "action": "Не заполняя ни одного вопроса, нажать кнопку \"Отправить анкету\".",
      "expected_result": "Отправка блокируется. Обязательные вопросы подсвечиваются красным (ошибка валидации). Отображаются сообщения об ошибках под обязательными полями (например, \"Обязательный вопрос\", \"Выберите оценку\"). Форма не отправляется."
    },
    {
      "step_number": 3,
      "action": "Заполнить все вопросы анкеты, проставив оценки по шкале 1-10: Для каждого вопроса выбрать одну оценку (например, все оценки = 5) Нажать кнопку \"Отправить анкету\"",
      "expected_result": "Все выбранные оценки визуально отмечены (кнопки подсвечены/активны). После нажатия форма успешно отправляется. Отображается сообщение/модальное окно с подтверждением: Текст: \" Спасибо за оценку. Нам очень важно Ваше мнение!\""
    },
    {
      "step_number": 4,
      "action": "Обновить страницу программы (F5). Перейти на вкладку \"Анкеты\"",
      "expected_result": "Форма анкеты остаётся на странице с проставленными оценками (все оценки = 5, визуально отмечены). Кнопка \"Отправить анкету\" скрыта (или неактивна) — повторная отправка невозможна. Внизу формы отображается зелёное сообщение: \"Спасибо за оценку. Нам очень важно Ваше мнение!\" Вопросы и текст анкеты остаются видимыми (форма не скрывается полностью). Оценки нельзя изменить (поля заблокированы для редактирования)."
    }
  ],
  "expected_result": "Позитивное и негативное тестирование функционала анкетирования на странице программы. Проверка валидации обязательных вопросов, успешной отправки и сохранения ответов в админке.",
  "notes": "Позитивное и негативное тестирование функционала анкетирования на странице программы. Проверка валидации обязательных вопросов, успешной отправки и сохранения ответов в админке.\nLegacy: статус=Actual, серьезность=Major"
}
