{
  "id": "NAVI2E-854",
  "module": "activities",
  "priority": "Medium",
  "type": "positive",
  "title": "Сайт. Мероприятия. Календарь: цветовая маркировка прошедших и будущих дней",
  "preconditions": [
    "На стенде опубликованы мероприятия как минимум на одну прошедшую дату и одну будущую дату относительно текущей даты.",
    "Открыть календарь мероприятий на текущий месяц."
  ],
  "steps": [
    {
      "step_number": 1,
      "action": "Визуально проверить цветовую маркировку счётчиков мероприятий в календаре. Сравнить цвета счётчиков для прошедших и будущих дат.",
      "expected_result": "Дни с мероприятиями, которые уже прошли (относительно текущей даты), имеют красный счётчик (иконка \"книжка\" и число красного цвета). Дни с мероприятиями, которые ещё предстоят (будущие даты), имеют зелёный счётчик (иконка и число зелёного цвета). Дни без мероприятий не имеют счётчика. Текущий день (если есть мероприятия) отображается согласно логике системы (уточнить по факту: красный или зелёный)."
    }
  ],
  "expected_result": "Проверка цветовой индикации дней в календаре: прошедшие дни выделяются красным, будущие — зелёным.",
  "notes": "Проверка цветовой индикации дней в календаре: прошедшие дни выделяются красным, будущие — зелёным.\nLegacy: статус=Draft, серьезность=Major"
}
